Title,Date,Text,Text_diff_new,Text_diff_old
17_Crt,30.9.2019.,"['Slika 25. Mjere i oblik strelica za smjer desno (H24)', 'Slika 26. Mjere i oblik strelica za označavanje smjera vožnje ispred raskrižja s kružnim tokom prometa (H25, H26 i H27)', '6.6.3. Strelice za označavanje dva ili više smjerova vožnje (H28-H36)', 'Strelice za označavanje dva ili više smjerova vožnje su:', '• strelica za ravno i lijevo (H28)', '• strelica za ravno i desno (H29)', '• strelica za lijevo i desno (H30)', '• strelica za ravno, lijevo i desno (H31)', '• strelica za ravno i lijevo na raskrižjima s kružnim tokom prometa s više prometnih traka (H32)', '• strelica za ravno i desno na raskrižjima s kružnim tokom prometa s više prometnih traka (H33)', '• strelica za lijevo i desno na raskrižjima s kružnim tokom prometa s više prometnih traka (H34)', '• strelica za ravno, lijevo i desno na raskrižjima s kružnim tokom prometa s više prometnih traka (H35)', '• strelica namijenjena za označavanje smjerova kretanja u raskrižju s kružnim tokom prometa tipa »turbo rotor« (H36).', 'Oblici i mjere strelica za označavanje dva ili više smjerova vožnje prikazani su na slikama 27., 28., 29., 30., 31.,32.,33. i 34.', 'Slika 27. Mjere i oblik strelica za smjer ravno i lijevo (H28)', 'Slika 28. Mjere i oblik strelica za smjer ravno i desno (H29)', 'Slika 29. Mjere i oblik strelica za smjer lijevo i desno (H30)', 'Slika 30. Mjere i oblik strelica za tri smjera vožnje (H31)', 'Slika 31. Mjere i oblik strelica za smjer ravno i lijevo te ravno i desno na raskrižjima s kružnim tokom prometa (H32 i H33)']",,
18_Crt,30.9.2019.,"['Slika 32. Mjere i oblik strelica za smjer lijevo i desno ispred raskrižja s kružnim tokom prometa (H34)', 'Slika 33. Mjere i oblik strelica za tri smjera vožnje ispred raskrižja s kružnim tokom prometa (H35)']",,
19_Crt,30.9.2019.,"['Slika 34. Mjere i oblik strelica za tri smjera vožnje ispred raskrižja s kružnim tokom prometa tipa »turbo rotor« (H36)', '6.3.4. Strelice za prestrojavanje na dva bliža raskrižja (H37 i H38)', 'Strelice za prestrojavanje na dva bliža raskrižja, gdje se prestrojavanje za skretanje na drugom raskrižju, zbog međusobne blizine, mora izvršiti na prvom raskrižju na kojem nije dozvoljeno skretanje u naznačenom smjeru su:', '• strelica za lijevo na drugom raskrižju gdje se prestrojavanje mora obaviti prije prvog raskrižja na kojem nije dozvoljeno skretanje na naznačenom smjeru (H37)', '• strelica za desno na drugom raskrižju gdje se prestrojavanje mora obaviti prije prvog raskrižja na kojem nije dozvoljeno skretanje na naznačenom smjeru (H38)', 'Oblici i mjere strelica za prestrojavanje na dva bliža raskrižja prikazani su na slikama 35. i 36.', 'Slika 35. Mjere i oblik strelica za smjer vožnje lijevo ispred dva bliska raskrižja (H37)', 'Slika 36. Mjere i oblik strelica za smjer vožnje desno ispred dva bliska raskrižja (H38)', '6.3.5. Strelice za označavanje namjene prometnih traka u zoni razdvajanja na autocestama i brzim cestama (H39-H41)', 'Strelice za označavanje namjene prometnih traka u zoni razdvajanja na autocestama i brzim cestama su:', '• strelica za desno na prometnoj traci (H39)', '• strelica za lijevo na prometnoj traci (H40)', '• strelica za lijevo i desno na prometnoj traci (H41)', 'Oblici i mjere strelica za označavanje namjene prometnih traka u zoni razdvajanja na autocestama i brzim cestama prikazani su na slikama 37. i 38.', 'Slika 37. Mjere i oblik strelica za smjer desno i smjer lijevo u zoni razdvajanja na autocestama i brzim cestama (H39 i H40)']",,
20_Crt,30.9.2019.,"['Slika 38. Mjere i oblik strelica za smjerove lijevo i desno u zoni razdvajanja na autocestama i brzim cestama (H41)', '6.3.6. Strelice za skretanje prometa i najave završetka pretjecanja (H42 i H43)', 'Na području preusmjeravanja prometa zbog ukidanja prometnih traka koriste se strelice za usmjeravanje prometa (H42). Duljina strelica je 5,00 metara, a njihova širina ovisi o širini prometnih traka na kojima se postavljaju. Na prometnim trakama širine manje ili jednake 3,00 metra, postavlja se strelica širine 2,00 metra, a na prometnim trakama širine veće od 3,00 metra, postavljaju se strelice širine 2,90 metara.', 'Oblici i mjere strelica za skretanje prometa prikazani su na slici 39.', 'Slika 39. Mjere i oblici strelica za skretanje prometa (H42)', 'Na području završetka pretjecanja, koristi se strelica (H43) duljine 7,50 metara prikazana na slici 40.', 'Slika 40. Mjere i oblik strelica za označavanje najave završetka pretjecanja (H43)', '6.3.7. Strelice za označavanje smjera kretanja vozila u garažama', 'U garažama se smjer kretanja vozila označava se pomoću strelice, čije su mjere prikazane na slici 41.', 'Slika 41. Mjere i oblik strelica za označavanje smjera vožnje u garažama']",,
21_Crt,30.9.2019.,"['6.3.8. Strelice za označavanje smjera kretanja na biciklističkim površinama', 'Na biciklističkim trakama, stazama i cestama, za određivanje smjera kretanja, koriste se sljedeće strelice:', '• strelica za lijevo', '• strelica za ravno', '• strelica za desno', '• strelica za ravno i lijevo', '• strelica za lijevo i desno', '• strelica za ravno i desno.', 'Duljina strelica za označavanje smjera kretanja na biciklističkim površinama iznosi 1,60 metara, a oblici i mjere su prikazani na slici 42.', 'Slika 42. Mjere i oblik strelica za označavanje smjera vožnje na biciklističkim površinama']",,
22_Crt,30.9.2019.,"['6.3.9. Polja za usmjeravanje prometa (H44-H48)', 'Polja za usmjeravanje prometa su:', '• polja za usmjeravanje prometa između dva traka sa suprotnim smjerovima (H44)', '• polja za usmjeravanje prometa između dva traka sa istim smjerovima (H45)', '• polja za usmjeravanje prometa na mjestu otvaranja posebnog traka za skretanje (H46)', '• polja za usmjeravanje prometa ispred otoka za razdvajanje prometnih tokova (H47)', '• polja za usmjeravanje prometa na ulaznom ili izlaznom kraku na autocesti, odnosno brzoj cesti (H48).', 'Osnovne karakteristike polja za usmjeravanje prometa:', '• širina crta (š), koja okružuju polje za usmjeravanje prometa određuje se pod istim kriterijima kao i kod punih razdjelnih crta (Tablica 1.)', '• paralelne crte kod polja za usmjeravanja prometa označuju se:', 'o \xa0\xa0\xa0\xa0\xa0\xa0\xa0\xa0pod kutom od 30 stupnjeva u odnosu na os ceste', 'o \xa0\xa0\xa0\xa0na autocestama i brzim cestama širine 0,50 metara, a na ostalim cestama 0,20 metara', 'o \xa0\xa0\xa0\xa0razmak između susjednih crta kod polja za usmjeravanje na autocestama i brzim cestama je 1,50 metara, na ostalim cestama je 0,60 metara', '• između crta koje okružuju polje za usmjeravanje i usporednih crta polja za usmjeravanje praznina je 0,10 metara, osim kod polja za označavanje ulaznih i izlaznih krakova na autocestama i brzim cestama, gdje je označena cijela površina (do 2 m širine)', '• na početku i na kraju polja se, unutar polja umjesto kosih crta, površina u cijelosti boja do širine koja je jednaka dvostrukoj širini crte koja okružuje polje. Treba poštivati odredbe prethodne točke: ta odredba se ne odnosi na polja kod ulaznih i izlaznih krakova na autocestama i brzim cestama, gdje je označena cijela površina do širine 2 metra', '• u slučaju kada su prometne trake odvojene dvostrukom razdjelnom punom crtom, odredba s prijašnje točke se ne primjenjuje, nego se u polju označe samo usporedne crte koje se počinju označavati kada je razmak između razdjelnih crta veći od 0,40 metara,', '• polja površine do 3,00 kvadratna metra na autocestama i brzim cestama te do 1,50 kvadratnih metara na ostalim cestama mogu se označiti u cijelosti.', 'Oblik i mjere polja za usmjeravanje prometa prikazana su na slikama 43., 44., 45., 46., 47., 48., 49., 50. i 51.', 'Slika 43. Mjere i oblik polja za usmjeravanje prometa između prometnih traka na kojima se promet odvija u suprotnim smjerovima (H44)', 'Slika 44. Mjere i oblik polja za usmjeravanje prometa između prometnih traka na autocestama i brzim cestama na kojima se promet odvija u suprotnim smjerovima (H44)', 'Slika 45. Mjere i oblik polja za usmjeravanje prometa između prometnih traka na kojima se promet odvija u istom smjeru (H45)', 'Slika 46. Mjere i oblik polja za usmjeravanje prometa između prometnih traka na autocestama i brzim cestama na kojima se promet odvija u istom smjeru (H45)', 'Slika 47. Mjere i oblik polja za usmjeravanje prometa na mjestu otvaranja prometne trake za skretanje (H46)', 'Slika 48. Mjere i oblik polja za usmjeravanje prometa ispred otoka za razdvajanje prometnih tokova –potpuno obojana površina (H47 i H47-1)', 'Slika 49. Mjere i oblik polja za usmjeravanje prometa ispred otoka za razdvajanje prometnih tokova –kose linije u ravnini s osi zatvaranja (H47-2 i H47-3)']",,
23_Crt,30.9.2019.,"['Slika 50. Mjere i oblik polja za usmjeravanje prometa na ulaznoj traci na autocesti i brzoj cesti (H48)', 'Slika 51. Mjere i oblik polja za usmjeravanje prometa na izlaznoj traci na autocesti i brzoj cesti (H48-1)']",,
24_Crt,30.9.2019.,"['Dozvoljena brzina Odnos između pomaka (a) i duljine crte (b)', 'Do 50 km/h a : b = 1 : 10', '50 do 70 km/h a : b = 1 : 20', 'Veća od 70 km/h a : b = 1 : 30', '6.3.10. Crte usmjeravanja (H49 i H50)', 'Crte usmjeravanja označuju mjesto promjene slobodne površine, a izvode se kao:', '• crte usmjeravanja za oblikovanje prepreke na rubu ceste (H49)', '• crte usmjeravanja za označavanje promjene korisne površine kolnika (H50)', 'Za izvedbu crta usmjeravanja vrijede sve odredbe glede mjera i načina označavanja kao i za polja za usmjeravanje prometa (poglavlje 6.3.2.).', 'Odnos između pomaka u smjeru vožnje i duljine, na kojoj se taj pomak izvodi, je ovisan o dozvoljenoj brzini na promatranom odsjeku ceste. Omjeri za različite dozvoljene brzine su prikazani u tablici 7.', 'Tablica 7.', 'Odnos između pomaka i duljine crte', 'Mjere i način izvođenja crte usmjeravanja za oblikovanje prepreke na rubu ceste su prikazane na slici 52., a crta usmjeravanja za označavanje promjene korisne površine kolnika sa više prometnih traka na slici 53.']",,
25_Crt,30.9.2019.,"['Slika 52. Mjere i način označavanja crte za oblikovanje prepreke na rubu ceste za brzinu vožnje između 50 i 70 km/h (H49)', 'Slika 53. Mjere i način označavanja crta usmjeravanja za ukidanje jedne prometne trake s više prometnih traka pri brzini 50 km/h (H50)', '6.3.11. Oznake na površinama za posebne namjene', 'Površine posebnih namjena (oblici i mjere prikazani u ovom poglavlju) odnose se na:', '• dijelove kolnika na kojem je zabranjeno parkiranje (H51) –slika 54.', '• dijelove kolnika na kojem je zabranjeno zaustavljanje i parkiranje između označenih parkirališnih mjesta (H52) –slika 55.,', '• autobusna stajališta (H53, H53-1 i H53-2), koje se sastoji od natpisa »BUS« (detalji slova prikazani su na slikama 72. i 73.) i drugih simbola (detalji ostalih simbola prikazani su na slici 56.).', '• stajališta za taxi vozila ili vozila »shuttle« prijevoza na kolniku (H54 i H54-3) –slika 58. i 59.,', '• stajališta za taxi vozila ili vozila »shuttle« prijevoza na ugibalištu (H54-1 i H54-2) –slika 60. i 61.', '• mjesta na cesti, na kojima se izvode prepreke za smirivanje prometa koje se dijele na:', 'o \xa0\xa0\xa0\xa0umjetne izbočine za smirivanje prometa (H55) –slika 62.,', 'o \xa0\xa0\xa0\xa0uzdignute plohe za smirivanje prometa (H55-1) –slika 63. (detalji simbola prikazani su na slici 64.),', 'Sve gore navedene oznake su žute boje.', 'Slika 54. Mjere i oblik oznaka za zabranu parkiranja na kolniku (H51)', 'Slika 55. Mjere i oblik oznake mjesta na kolniku na kojemu je zabranjeno zaustavljanje i pakiranje između parkirališnih mjesta (H52)', 'Autobusna stajališta se kombiniraju sa simbolima prikazanim na slici 56. i natpisom »BUS« čiji su detalji prikazani na slikama 72. i 73. Primjer označavanja autobusnog stajališta prikazan je na slici 57. Kombinacija simbola i natpisa ovisi o duljini autobusnog stajališta, odnosno o geometriji ugibališta i kolnika.', 'Slika 56. Mjere i oblik oznaka na autobusnim stajalištima', 'Slika 57. Primjer obilježavanje autobusnog stajališta na kolniku (H53)', 'Slika 58. Mjere i oblik oznaka za obilježavanje stajališta za taxi vozila na kolniku (H54)', 'Slika 59. Mjere i oblik oznaka za obilježavanje stajališta za vozila »shuttle« prijevoza na kolniku (H54-3)', 'Slika 60. Mjere i oblik oznaka za obilježavanje stajališta za taxi vozila na ugibalištu (H54-1)', 'Slika 61. Mjere i oblik oznaka za obilježavanje stajališta vozila »shuttle« prijevoza na ugibalištu (H54-2)']",,
26_Crt,30.9.2019.,"['Vozilo Dužina parkirališnog mjesta (a) Širina parkirališnog mjesta (b) Širina prilaza parkirališnom mjestu (c)', 'Osobno vozilo 5,50 m 2,20 m 3,50 m', 'Autobus 16,00 m 3,00 m 4,50 m', 'Teretno vozilo 18,00 m 3,00 m 4,50 m', 'Motocikl 2,0 m 1,00 m -', 'Bicikl 2,0 m 0,50 m -', 'Vozilo Dužina parkirališnog mjesta (a) Širina parkirališnog mjesta (b) Širina prilaza parkirališnom mjestu (c)', 'Osobno vozilo 5,00 m 2,50 m 5,40 m', 'Autobus 12,00 m 4,00 m 14,50* m \r 9,50** m', 'Teretno vozilo 16,00 m 3,50 14,50* m \r 9,50** m', 'Motocikl 2,00 m 1,00 m -', '*Parkiranje hodom naprijed \r * *Parkiranje hodom unazad', 'Vozilo Kut \r parkiranja \r Dužina parkirališnog mjesta (a) Širina parkirališnog mjesta (b) Širina prilaza parkirališnom mjestu (c)', 'Osobno vozilo 30 \r 45 \r 60 \r 4,30 m \r 5,00 m \r 5,30 m \r 2,30 m \r 2,50 m \r 2,50 m \r 2,80 m', '3,00 m', '4,70 m', 'Autobus 45 \r 60 \r 12,00 m \r 13,00 m \r 4,00 m \r 4,00 m \r 7,00 m', '10,00 m', 'Teretno vozilo 45 \r 60 \r 17,00 m \r 18,00 m \r 3,50 m \r 3,50 m \r 7,00 m', '10,00 m', 'Motocikl 45 \r 60 \r 1,80 m \r 1,80 m \r 1,00 m \r 1,00 m \r -', '-', 'Bicikl 45 \r 60 \r 1,80 m \r 1,80 m \r 0,50 m \r 0,50 m', '', 'Oznake za označavanje prepreka za smirivanje prometa koriste se za označavanje »umjetne izbočine« (K35) ili »uzdignute plohe« (K36).', 'U svrhu dodatnog označavanja naprava za smirivanje prometa prije naprave mogu se izvesti »cik-cak« crte žutom bojom kojima se vizualno naglašava približavanje napravama za smirivanje prometa (H55-2 i H55-3) kao što je prikazano na slikama 62. i 63.', 'Detalji oblika oznake za označavanje »uzdignute plohe« (K36) prikazani su na slici 64.', 'Slika 62.Oblici i mjere oznaka za privremeno smirivanje prometa pomoću umjetne izbočine za smirivanje prometa (H55-2)', 'Slika 63. Oblici i mjere oznaka za trajno smirivanje prometa pomoću umjetne izbočine za smirivanje prometa (H55-3)', 'Slika 64. Detalji oblika za smirivanje prometa', '6.3.12. Oznake parkirališnih mjesta i površina za parkiranje', 'Označavanje parkirališnih mjesta ovisi o načinu parkiranja, koje se dijeli na:', '• parkirališna mjesta za parkiranje vozila isključivo osoba s invaliditetom (H57) –slika 65.,', '• uzdužno parkiranje (H61) –slika 66.', '• okomito parkiranje (H61-1) –slika 67.', '• koso parkiranje (H61-2) –slika 68. S obzirom na smjer vožnje, kosa parkirališna mjesta mogu biti izvedena kao:', 'o \xa0\xa0\xa0\xa0koso parkiranje pod kutom od 30 stupnjeva', 'o \xa0\xa0\xa0\xa0koso parkiranje pod kutom od 45 stupnjeva', 'o \xa0\xa0\xa0\xa0koso parkiranje pod kutom od 60 stupnjeva.', 'Ovisno o vrsti vozila, parkirališna mjesta se dijele na:', '• parkirališna mjesta za parkiranje motocikala', '• parkirališna mjesta za parkiranje osobnih vozila', '• parkirališna mjesta za parkiranje osobnih vozila s prikolicom, manjih teretnih vozila i autobusa', '• parkirališna mjesta za parkiranje teretnih vozila s prikolicom ili poluprikolicom.', 'Mjere oznaka:', '• širina svih crta kojima su označena parkirališna mjesta je 0,10 metara', '• duljina poprečnih linija, koje odvajaju pojedinačna parkirališna mjesta, ovisi o širini parkirališta', '• duljina uzdužne crte na granici između dva parkirališna mjesta kod uzdužnog parkiranja je 2,00 metra, osim kod prvih i zadnjih parkirališnih mjesta, gdje je ta linija duljine 1,00 metara', '• duljina uzdužne linije na granici između dva parkirna mjesta kod parkiranja pod kutom iznosi 1,00 metar, osim kod prvog i posljednjeg parkirališnog mjesta, gdje ta duljina iznosi 0,50 m', '• mreža crta za longitudinalno parkiranje bez označavanja pojedinih parkirališnih mjesta je dimenzija 1,00 –1,00 –1,00 metar.', 'Mjere parkirališnih mjesta ovise o vrsti vozila i načinu označavanja.', '6.3.13. Oznake parkirališnih mjesta za osobe sa invaliditetom (H57)', 'Slika 65. Mjere i oblik oznaka za označavanje parkirališnih mjesta za osobe s invaliditetom (H57)', '6.3.14. Oznake parkirališnih mjesta za uzdužno parkiranje (H61)', 'Kod uzdužnog parkiranja, parkirališna mjesta označena su paralelno s osi ceste, odnosno s rubom kolnika.', 'Parkirališna mjesta mogu se označiti pojedinačno ili je skup parkirališnih mjesta označen uz kolnik.', 'Oblici i minimalne mjere parkirališnih mjesta za uzdužno parkiranje prikazani su na slici 66. Minimalne mjere parkirališnih mjesta i minimalna širina prometnih traka ovisno o vrsti vozila za koju su namijenjena, prikazani su u tablici 8.', 'Slika 66. Minimalne mjere i oblik oznaka za obilježavanje uzdužnih parkirališnih mjesta (H61)', 'Tablica 8.', 'Minimalne mjere parkirališnih mjesta kod uzdužnog parkiranja', '6.3.15. Oznake parkirališnih mjesta za okomito parkiranje (H61-1)', 'Kod okomitog parkiranja, parkirališna mjesta moraju biti označena pod kutom od 90 stupnjeva u odnosu na os ceste ili rub kolnika.', 'Obilježavanje parkirnih mjesta za okomito parkiranje prikazano je na slici 67. Minimalne mjere parkirališnih mjesta i minimalna širina prometnih traka ovisno o vrsti vozila za koju su namijenjena, prikazani su u tablici 9.', 'Slika 67. Minimalne mjere i oblik oznaka za obilježavanje okomitih parkirališnih mjesta (H61-1)', 'Tablica 9.', 'Minimalne mjere parkirališnih mjesta kod okomitog parkiranja', '6.3.16. Oznake parkirališnih mjesta za koso parkiranje (H61-2)', 'Kod kosog parkiranja, parkirno mjesto označeno je u pod kutovima od 60°, 45° i 30° u odnosu na os ceste ili rub kolnika.', 'Oblici i minimalne mjere parkirališnih mjesta za koso parkiranje prikazani su na slici 68. Minimalne mjere parkirališnih mjesta i minimalna širina prometnih traka ovisno o vrsti vozila za koju su namijenjena, prikazani su u tablici 10.', 'Slika 68. Minimalne mjere i oblik kosih parkirališnih mjesta (H61-2)', 'Tablica 10.', 'Minimalne mjere parkirališnih mjesta kod kosog parkiranja', '6.3.17. Natpisi i simboli na kolniku', 'Natpisi i simboli na kolniku se upotrebljavaju kao samostalna ili dodatna prometna signalizacija za obavještavanje vozača.', 'Prema namjeni natpisi i simboli dijele se na:', '• natpise i simbole koji nadopunjuju putokaznu signalizaciju (nazivi mjesta, država, dijelova grada),', '• natpise i simbole koji nadopunjuju znakove opasnosti i znakove izričitih naredbi (npr. STOP, ŠKOLA, X),', '• simbole prometnih znakova opasnosti i znakova izričitih naredbi (npr. znakovi ograničenja brzine, znakovi upozorenja na raskrižju, prijelaz ceste preko željezničke pruge, pješački prijelazi),', '• natpise i simbole koji označuju prometne površine za posebne namjene (BUS, TAXI, biciklističke trake),', '• natpise i simbole koji označuju parkirne površine namijenjene za određene vrste korisnika (invalidi, rezervirano parkiranje).', 'Za natpise se upotrebljavaju brojevi i slova, za simbole prije svega prometni znakovi, a elipse za siluete i oznake država.', 'Natpisi na kolniku moraju biti prikladno povećani i rastegnuti. Povećanje je potrebno radi bolje uočljivosti, dok se slova moraju rastegnuti radi boljeg raspoznavanja. Faktori povećanja i položenosti su prikazani u dijagramu na slici 69. S njima je potrebno množiti osnovne mjere brojki i slova.', 'Osnovni oblici i mjere brojki i slova, koji se upotrebljavaju za izvedbu natpisa, prikazani su na slikama 70. i 71.', 'Slika 69. Dijagram faktora za izračun povećanja i rastegnutosti natpisa na kolniku']",,
27_Crt,30.9.2019.,"['Minimalna dimenzija natpisa na kolniku za autoceste i brze ceste iznosi 12,0 metara, dok se za ostale ceste, u pravilu upotrebljava visina natpisa od 4,0 metra. Oblik i mjere brojeva i slova koje se koriste za označavanje na kolniku, povećane i rastegnute u skladu s dijagramom (prikazanim na slici 69.), su prikazane na slikama 72., 73. i 74.', 'Slika 70. Mjere i osnovni oblik brojeva koji se koriste za natpise na kolniku', 'Slika 71. Mjere i osnovni oblik slova koja se koriste za natpise na kolniku', 'Slika 72. Mjere i oblici slova visine 4,00 metra koja se koriste za natpise na kolniku', 'Slika 73. Mjere i oblici slova visine 4,00 metra koja se koriste za natpise na kolniku', 'Slika 74. Mjere i oblici brojeva visine 4,00 metra koji se koriste za natpise na kolniku']",,
