Title,Date,Text,Text_diff_new,Text_diff_old
4_Crt,30.9.2019.,"['Područje primjene Posebni uvjeti Visina slova i simbola, cm', 'Autocesta Prometni znak postavljen iznad kolnika 35', 'Prometni znak postavljen sa strane kolnika 28', 'Brza cesta i cesta namijenjena isključivo za promet motornih vozila Prometni znak postavljen iznad kolnika 35', 'Prometni znak postavljen sa strane kolnika 28', 'Priključna cesta na autocestu ili brzu cestu - 21 (iznimno 17,5)', 'Državne ceste, županijske ceste i višetračne gradske ulice - 17,5 (iznimno 14,0 ili 10,5)', 'Sve ostale ceste i ulice - 10,5', 'D. Znakovi obavijesti za vođenje prometa', 'Članak 28.', 'Znakovi obavijesti za vođenje prometa obavješćuju sudionike u prometu o pružanju cestovnih smjerova, rasporedu odredišta i vođenju prometa prema njima, raskrižjima i čvorištima na određenom smjeru ceste i udaljenostima do odredišta.', 'Članak 29.', '(1) Osnovna boja znakova obavijesti za vođenje prometa je:', '1) na autocestama zelena sa simbolima i natpisima bijele boje', '2) na brzim cestama plava sa simbolima i natpisima bijele boje', '3) na državnim i ostalim cestama žuta sa simbolima i natpisima crne boje', '4) za dijelove gradova, naselja i značajne objekte bijela sa simbolima i natpisima crne boje.', '(2) Na istom znaku (ploči) mogu se na osnovnu podlogu umetnuti podloge odgovarajućih boja ovisno o vrsti ceste koja vodi do naznačena odredišta.', 'Članak 30.', 'Veličine znakova obavijesti za vođenje prometa ovise o visini i broju pojmova (slova) na znaku. Najmanje visine pojmova definirane su u tablici 5.', 'Tablica 5.', 'Najmanje visine pojmova (slova) na znaku', 'Članak 31.', 'Obavješćivanje sudionika u prometu prometnim znakovima obavijesti za vođenje prometa provodi se u pet stupnjeva, i to:', 'I. »prethodno obavješćivanje«', 'II. »obavješćivanje o smjeru kretanja«', 'III. »obavješćivanje o prestrojavanju«', 'IV. »obavješćivanje o skretanju«', 'V. »potvrdno obavješćivanje«.', 'Članak 32.', '(1) Na autocestama i brzim cestama mora se postaviti svih pet stupnjeva obavijesti.', '(2) Na mjerodavnim raskrižjima državnih i županijskih cesta, a ovisno o svrsi i cilju vođenja prometa, mora se postaviti najmanje drugi i četvrti stupanj, a treći ako je cesta s tri i više prometnih traka.', '(3) Na mjerodavnim raskrižjima svih ostalih cesta, a ovisno o svrsi i cilju vođenja prometa, mora se postaviti najmanje četvrti stupanj obavijesti.', 'Članak 33.', 'Ovisno o vrsti i kategoriji ceste, geometrijskom oblikovanju raskrižja te o udaljenosti dvaju susjednih raskrižja, može se izostaviti ili dodati jedan od stupnjeva obavijesti, osim četvrtog stupnja obavijesti koji je obavezan.', 'Članak 34.', 'Oznake, oblik, boja i značenje znakova obavijesti za vođenje prometa prikazani su u tablici 6.']",,
5_Crt,30.9.2019.,"['Oznaka Oblik, boja i značenje A Svrha označavanja', 'B Dopuštene izvedbe znaka i njihove oznake', 'Dodatni zahtjevi za implementaciju', 'C Posebni uvjeti za postavljanje znaka', '1 2 3 4', 'Znakovi obavijesti za vođenje prometa u prvom stupnju', 'D01 \r A Najavljuje izlaz s autoceste ili brze ceste s oznakom izlaza.', 'B Ako se znak odnosi na autoceste, tada je zelene boje, a ako se odnosi na brze ceste plave je boje. \r Znak se izvodi najmanje s koeficijentom retrorefleksije razreda RA2.', 'C Prometni znak se, u pravilu, postavlja na udaljenosti od 2000 m prije početka izlazne prometne trake s autoceste ili brze ceste.', 'D02 \r A Najavljuje interregionalno čvorište autocesta ili brzih cesta s oznakom čvorišta.', 'B Ako se znak odnosi na autoceste, tad je zelene boje, a ako se odnosi na brze ceste plave je boje. \r Znak se izvodi najmanje s koeficijentom retrorefleksije razreda RA2.', 'C Prometni znak se, u pravilu, postavlja na udaljenosti od 2000 m prije početka izlazne prometne trake interregionalnog čvorišta autoceste ili brze ceste.', 'Znakovi obavijesti za vođenje prometa u drugom stupnju', 'D03 \r A Označavaju međusobni položaj, smjerove cesta, brojeve cesta te nazive mjesta do kojih vode ceste što se križaju.', 'B', 'Položaj strelica mora odgovarati položaju cesta na terenu. \r Položaj oznake broja ceste iznad strelice za ravno može biti lijevo ili ispod naziva mjesta ovisno o broju cesta i broju naziva mjesta koje je potrebno naznačiti. \r Položaj oznake broja ceste za lijevo i desno može biti u smjeru strelice ili ispod naziva mjesta. \r Znakovi se postavljaju na udaljenosti od najmanje 150 m ispred raskrižja na koje se odnosi. \r Boja podloge znaka određuje se prema vrsti ceste na koju se znak postavlja. Za odredišta koja se nalaze na cestama druge vrste upotrebljava se umetnuta podloga, čija boja odgovara vrsti ceste na koju se upućuje. \r Maksimalan broj naziva odredišta na znaku, u svim smjerovima, je šest. U jednom smjeru maksimalno je moguće označiti tri naziva odredišta. \r Znakovi se izvode najmanje s koeficijentom retrorefleksije razreda RA2.', 'C Znak može sadržavati broj i oznaku ceste, »nacionalna auto oznaka« (C124) te simbol graničnog prijelaza.', 'D04 \r A Označavaju ime izlaza ili izdvajanje na autocesti i cestama s raskrižjima u više razina.', 'B', 'Položaj strelica mora odgovarati položaju cesta na terenu. \r Položaj oznake broja ceste iznad strelice za ravno može biti lijevo ili ispod naziva mjesta, ovisno o broju cesta i broju naziva mjesta koje je potrebno naznačiti. \r Znak D04-1 postavlja se na interregionalnim čvorištima. Kad se znak D04-2 izvodi na portalu u trećem stupnju obavijesti, nema bijelog polja nego se udaljenost do izlaza upisuje u zeleno polje ispred broja ceste na koju se izlazi. \r Boja podloge znaka određuje se prema vrsti ceste na koju se znak postavlja. Za odredišta koja se nalaze na cestama druge vrste upotrebljava se umetnuta podloga čija boja odgovara vrsti ceste na koju se upućuje. \r Maksimalan broj naziva odredišta na znaku, u svim smjerovima, je šest. U jednom smjeru maksimalno je moguće označiti tri naziva odredišta. \r Znakovi se izvode najmanje s koeficijentom retrorefleksije razreda RA2.', 'C Znakovi D04 i D04-1 postavljaju se s desne strane kolnika, a znak D04-2 postavlja se na portalu iznad kolnika. \r Znak može sadržavati broj i oznaku ceste, »nacionalna auto oznaka« (C124) te simbol graničnog prijelaza.', 'Znakovi obavijesti za vođenje prometa u trećem stupnju', 'D05 \r A Označava smjer kretanja do naseljenih mjesta.', 'B Znak može imati najviše tri polja za označavanje različitih smjerova kretanja. Svako polje može imati najviše dva, a samo iznimno tri naziva za naseljena mjesta unutar polja. \r Polja se raspoređuju uvijek na isti način: gornje polje s strelicom ravno, označava kretanje u pravcu, srednje polje s strelicom lijevo, označava skretanje lijevo i donje polje s strelicom desno, označava skretanje desno. \r Na istom znaku smije se postaviti samo jedno polje za označavanje jednog smjera kretanja. \r Boja podloge polja za označavanje smjera kretanja određuje se prema vrsti ceste na koju se upućuje. \r Znak se izvodi najmanje s koeficijentom retrorefleksije razreda RA2.', 'C Znak može sadržavati broj i oznaku ceste, »nacionalna auto oznaka« (C124) te simbol graničnog prijelaza.', 'D06 \r A Označavaju smjer kretanja do naseljenih mjesta ispisanih na znaku.', 'B', 'Svako polje na znaku može imati najviše dva, a samo iznimno tri naziva za naseljena mjesta unutar polja. Ako na znaku D06 nema dovoljno mjesta za navesti sva odredišta, postavlja se znak D06-1. Maksimalni broj odredišta na znaku D06-1 je šest. \r Na istom znaku smije se postaviti samo jedno polje za označavanje jednog smjera kretanja. \r Boja podloge polja za označavanje smjera kretanja određuje se prema vrsti ceste na koju se upućuje. \r Znakovi se izvode najmanje s koeficijentom retrorefleksije razreda RA2.', 'C Na znaku se može izvesti oznaka broja ceste, »nacionalna auto oznaka« (C124) te odgovarajući simbol. \r Na znaku se može izvesti oznaka broja ceste, »nacionalna auto oznaka« (C124) te odgovarajući simbol.', 'Znakovi obavijesti za vođenje prometa u četvrtom stupnju', 'D07 \r A Označava smjer ceste za naseljeno mjesto ispisano na znaku i udaljenost u kilometrima (osim u bijelom polju).', 'B Znak može imati najviše tri polja za označavanje različitih smjerova kretanja. Svako polje može imati najviše dva, a samo iznimno tri naziva za naseljena mjesta unutar polja. Maksimalan broj naziva odredišta na znaku, u svim smjerovima, je šest. \r Polja se raspoređuju uvijek na isti način: gornje polje s strelicom ravno, označava kretanje u pravcu, srednje polje s strelicom lijevo, označava skretanje lijevo i donje polje s strelicom desno, označava skretanje desno. \r Na istom znaku smije se postaviti samo jedno polje za označavanje istog smjera kretanja. \r Kad se znak postavlja iznad kolnika (na portal), svako polje postavlja kao poseban znak iznad prometnih traka na koje se znak odnosi. \r Boja podloge polja za označavanje smjera kretanja određuje se prema vrsti ceste na koju se upućuje. \r Znak se izvodi najmanje s koeficijentom retrorefleksije razreda RA2.', 'C Znak može sadržavati broj i oznaku ceste, »nacionalna auto oznaka« (C124) te simbol graničnog prijelaza. \r Znak se postavlja na raskrižju na mjestu na kojem počinje cesta na koju se znak odnosi.', 'D08 \r A Na autocesti i cesti s raskrižjima u više razina označavaju smjer kretanja do naseljenih mjesta ispisanih na znakovima.', 'B', 'Na znakovima mogu biti ispisana tri mjesta uključujući i nazive nacionalnog parka, svetišta, olimpijskog centra ili nekog drugog sadržaja od nacionalnog značaja. \r Položaj strelica na znakovima mora odgovarati prometnoj situaciji, odnosno smjeru kretanja pojedinih prometnih traka. \r Boja podloge znaka određuje se prema vrsti ceste na koju se upućuje. \r Za odredišta koja se nalaze na cestama druge vrste upotrebljava se umetnuta podloga čija boja odgovara vrsti ceste na koju se upućuje ili je određena posebnim propisom. \r Ukoliko cesta vodi prema mjestu u drugoj državi ili graničnom prijelazu s lijeve strane od naziv može se umetnuti znak »zabrana prolaska bez zaustavljanja« (B33) koji označava granični prijelaz. \r Znakovi se izvode najmanje s koeficijentom retrorefleksije razreda RA2.', 'C Na znaku se može izvesti oznaka broja ceste, »nacionalna auto oznaka« (C124) te odgovarajući simbol. Znakovi se postavljaju na prilazima i u zoni raskrižja u više razina, dviju autocesta odnosno brzih cesta na mjestima na kojima počinje traka za usporenje vozila.', 'Znakovi obavijesti za vođenje prometa u petom stupnju', 'D09 \r A Označava potvrdu smjera kretanja nakon prolaza raskrižja.', 'B Znak sadrži nazive naseljenih mjesta, udaljenost u kilometrima do tih naseljena mjesta i broj ceste na kojoj se mjesto nalazi. \r Položaj oznake broja ceste je u sredini znaka iznad naziva naseljena mjesta, odnosno s njegove lijeve strane. \r Na znaku može biti ispisano najviše pet naziva naseljenih mjesta. \r Najudaljenije naseljeno mjesto se ispisuje uz gornji rub znaka, a najbliže uz donji rub znaka. \r Boja podloge znaka određuje se prema vrsti ceste na koju se znak postavlja. \r Znak se izvodi najmanje s koeficijentom retrorefleksije razreda RA2.', 'C Znak se postavlja u pravilu na udaljenosti najviše 500 m od posljednjeg priključka. \r Znak može sadržavati broj i oznaku ceste, »nacionalna auto oznaka« (C124) te simbol graničnog prijelaza.', 'Oznaka Oblik, boja i značenje A Svrha označavanja', 'B Dopuštene izvedbe znaka i njihove oznake', 'Dodatni zahtjevi za implementaciju', '1 2 3 4', 'E01 \r A Označava udaljenost između prometnog znaka uz koji je postavljena dopunska ploča i početka dijela ceste, odnosno mjesta na koje se znak odnosi.', 'B', 'E02 \r A Označavaju duljinu dijela ceste na kojem prijeti opasnost označena prometnim znakom, odnosno na kojem se primjenjuje izričita naredba označena znakom, ili na koji se odnosi sadržaj znaka uz koji se ističe dopunska ploča.', 'B', 'E03 \r A Označava udaljenost i smjer od prometnog znaka do objekta ili dijela ceste na koju se obavijest odnosi.', 'B', 'E04 \r A Označavaju vrijeme za koje izričita naredba, odnosno obavijesti vrijede, ako ne vrijede neprekidno.', 'B', 'E05 \r A Sadrži pobliže objašnjenje prometnog znaka riječima ili simbolom, ako to nije jasno određeno simbolom znaka.', 'B', 'E06 \r A Sadrže simbole vrste vozila na koje se prometni znak odnosi.', 'B', 'E07 \r A Označava najveću dopuštenu masu vozila na koju se izričita naredba odnosi.', 'B', 'E08 \r A Označava uklanjanje vozila »paukom« na mjestima na kojima je parkiranje ili zaustavljanje vozila prometnim znakom zabranjeno.', 'B Postavlja se uz prometne znakove »zabrana zaustavljanja i parkiranja« (B36) i »zabrana parkiranja« (B37).', 'E09 \r A Označavaju primjenu zabrane parkiranja ili zaustavljanja vozila do prometnog znaka, od prometnog znaka, odnosno s jedne ili druge strane prometnog znaka.', 'B', 'Postavljaju se uz prometne znakove »zabrana zaustavljanja i parkiranja« (B36) i »zabrana parkiranja« (B37).', 'E10 \r A Označavaju položaj parkiranja vozila.', 'B', 'Postavljaju se uz prometni znak »parkiralište« (C39, C39-1 i C39-2).', 'E11 \r A Označava mjesto na kojem je parkiranje rezervirano za vozila osoba s invaliditetom ili blizinu ceste na kojoj se može pojaviti osoba sa invaliditetom u kolicima.', 'B Postavlja se uz prometne znakove »parkiralište« (C39, C39-1 i C39-2), »parkiralište P+R sustava« (C40) i »opasnost na cesti« (A01).', 'E12 \r A Označava mjesto na kojem je parkiranje rezervirano za određene korisnike.', 'B Postavlja se uz prometne znakove »parkiralište« (C39, C39-1 i C39-2) i »parkiralište P+R sustava« (C40).', 'E13 \r A Označavaju početak dijela ceste, odnosno mjesta na kojem postoji opasnost od neočekivanih meteoroloških uvjeta značajnih za sigurno odvijanje prometa (kiša, snijeg i dr.)', 'B', 'Postavljaju se uz prometni znak »opasnost na cesti« (A01).', 'E14 \r A Označavaju položaj ceste s pravom prednosti.', 'B', 'Dopunska ploča E14 postavlja se uz prometni znak »cesta s prednošću prolaska« (C06), a dopunska ploča E14-1 postavlja se uz prometne znakove »raskrižje s cestom s prednošću prolaska« (B01) i »obavezno zaustavljanje« (B02).', 'E15 \r A Označavaju blizinu dijela ceste na kojem se mogu pojaviti starije nemoćne osobe (E15) te slijepe osobe (E15-1).', 'B', 'E16 \r A Označava početak dijela ceste na kojem se obavlja čišćenje snijega.', 'B Dopunska ploča je privremena i postavlja se za vrijeme obavljanja radova na održavanju cesta.', 'E17 \r A Objašnjavaju da se na cesti izvode radovi na održavanju cesta vezani uz izvođenje oznaka na kolniku (E17) ili košnju trave (E17-1).', 'B', 'Postavljaju se uz prometne znakove »opasnost na cesti« (A01) i »ograničenje brzine« (B30). \r Dopunske ploče su privremene i postavljaju se za vrijeme obavljanja radova na održavanju cesta.', 'E18 \r A Objašnjava da je prometni znak kojemu je dodana dopunska ploča postavljen zbog kolotraga na kolniku.', 'B Ploča se postavlja uz prometni znak »ograničenje brzine« (B30).', 'E19 \r A Označava mjesto na cesti gdje se nalazi oprema za smirivanje prometa (izbočine).', 'B Ploča se postavlja uz prometni znak »ograničenje brzine« (B30).', 'E20 \r A Označava prolaz za teretno motorno vozilo s izvan gabaritnim teretom.', 'B', 'E21 \r A Označava područje s povećanom koncentracijom opasnih tvari u zraku.', 'B', 'E22 \r A Označava potrebu isključenja rada motora vozila zbog dužeg stajanja na mjestima gdje je promet reguliran svjetlosnim uređajima.', 'B', 'E23 \r A Dopunska ploča »naplatni branik« označava zatvorenu voznu traku na naplatnoj postaji ceste.', 'B Znak se postavlja uz prometni znak »opasnost na cesti« (A01).', 'Tablica 6.', 'Oznake, oblik, boja i značenje znakova obavijesti za vođenje prometa', 'E. Dopunske ploče', 'Članak 35.', '(1) Dopunske ploče pobliže određuju značenje prometnog znaka.', '(2) Dopunske ploče mogu biti postavljene uz znakove opasnosti, znakove izričitih naredbi, znakove obavijesti i znakove obavijesti za vođenje prometa.', 'Članak 36.', '(1) Iznimno, privremene dopunske ploče postavlja pravna osoba koja održava cestu te policija u određenim uvjetima.', '(2) Dopunske ploče koje se postavljaju privremeno moraju se ukloniti nakon što prestanu razlozi zbog kojih su postavljene.', 'Članak 37.', '(1) Širina dopunske ploče postavljene uz prometni znak na cesti ne smije biti veća od dužine one stranice znaka uz koji se dopunska ploča postavlja, odnosno od projekcije krajnjih točaka znaka.', '(2) Ako ovim Pravilnikom nije određen simbol na dopunskoj ploči, dopuštena je uporaba međunarodnog simbola.', 'Članak 38.', 'Oznake, oblik, boja i značenje dopunskih ploča prikazane su u tablici 7.', 'Tablica 7.', 'Oznake, oblik, boja i značenje dopunskih ploča']",,
6_Crt,30.9.2019.,"['F. Promjenjivi prometni znakovi', 'Članak 39.', '(1) Prometni znakovi u cijelosti ili djelomice se mogu izvesti kao promjenjivi prometni znakovi.', '(2) Promjenjivi prometni znakovi izvode se kao kontinuirani i nekontinuirani, odnosno:', '1) elektromehanički prometni znakovi, koji prikazuju različite prometne znakove, dopunske ploče, obavijesti, poruke i simbole, a koji su izgledom jednaki stalnim prometnim znakovima i signalizaciji', '2) svjetlosni promjenjivi znakovi (SPZ) oblikuju znakove, simbole, dopunske ploče i ostale tekstualne poruke uporabom svjetlećih elemenata.', '(3) Svjetlosno promjenjivi prometni znakovi mogu se kombinirati sa stalnim prometnim znakovima. U tom slučaju, svjetlosno promjenjivi prometni znakovi gledano u smjeru vožnje, uvijek se postavljaju iza stalnog prometnog znaka.', '(4) Svjetlosno promjenjivi prometni znakovi, u pravilu, trebaju prikazivati samo znakove, simbole i dopunske ploče te samo u iznimnim slučajevima i tekstualne poruke.', 'Članak 40.', '(1) Elektromehanički prometni znakovi ne smiju se po boji i veličini razlikovati od stalnih prometnih znakova.', '(2) Ako su prometni znakovi izvedeni kao svjetlosni te ako tehnologija izvedbe svjetlosnog znaka ne omogućuje propisanu boju, upotrebljava se:', '1) umjesto osnovne boje prometnog znaka –crna boja bez retrorefleksije', '2) umjesto crnih i bijelih simbola –bijeli (žuti) simboli na prometnom znaku', '3) umjesto crnih rubova prometnog znaka –bijeli (žuti) rub prometnog znaka.', '(3) Ako se prometni znakovi prikazuju svjetlećim ili drugim diskretnim elementima prikaza, tehnički uvjetovana pojednostavnjenja prikaza dopuštena su samo uz uvjet da ostanu očuvani bitni elementi i svojstvena obilježja znakova.', '(4) Na svjetlosno promjenjivim prometnim znakovima prikaz sadržaja na zaslonu može se prikazivati kontinuirano ili diskontinuirano u određenom vremenskom razdoblju. Minimalno vrijeme prikaza za svaki sadržaj ovisi o najvećoj dopuštenoj brzini na cesti.', '(5) Svjetlosno promjenjivi prometni znakovi s kontinuiranim prikazom sadržaja imaju isto značenje kao prometni znakovi sa stalnim sadržajem.', 'Članak 41.', '(1) Promjenjivi nekontinuirani prometni znak ili dio znaka u slučaju kvara jednog dijela znaka ili pregaranja izvora svjetlosti ne smije promijeniti svoje značenje, odnosno mora biti bez signalnog pojma (nulto stanje).', '(2) Tijekom normalnih uvjeta vožnje na cesti, signalni pojmovi na promjenljivim nekontinuiranim prometnim znakovima moraju biti ugašeni. Kad se predviđa ili nastane promjena normalnih uvjeta vožnje na cesti, ovisno o nastalim promjenama, uključuje se za to predviđeni signalni pojam koji mora biti u funkciji do ponovne uspostave normalnih uvjeta vožnje.', '(3) Kad se promjenjivi prometni znak odnosi na ograničenje brzine, u pravilu, se postavlja iza stalnog prometnog znaka ograničenja brzine gledano u smjeru vožnje.', '(4) Zabranjeno je ispisivanje reklamnih poruka na promjenjivim prometnim znakovima, odnosno mogu se ispisivati tekstualni sadržaji koji imaju značenje obavijesti ukoliko je to u službi sigurnosti prometa.', 'Članak 42.', '(1) Razred retrorefleksije elektromehaničkih prometnih znakova mora odgovarati razredu retrorefleksije za stalne prometne znakove.', '(2) Svjetlosni prometni znakovi moraju zadovoljiti određene uvjete:', '1) sadržaj znaka mora biti prepoznatljiv s udaljenosti minimalno 150 m i znak mora biti čitljiv bez obzira na kut gledanja', '2) svjetlosni intenzitet znaka mora se prilagoditi svjetlosnim uvjetima okoliša i mora biti omogućen noćni režim rada.', 'III. PROMETNA SVJETLA', 'Članak 43.', '(1) Za upravljanje prometom upotrebljavaju se uređaji (semafori) kojima se daju prometni znakovi prometnim svjetlima crvene, žute i zelene boje.', '(2) Prometna svjetla jesu:', '1) prometna svjetla za upravljanje prometom', '2) prometna svjetla za upravljanje prometom pješaka i biciklista', '3) prometna svjetla za upravljanje javnim gradskim prometom', '4) prometna svjetla za upravljanje cestovnim prometom na prijelazu ceste preko željezničke pruge', '5) prometna svjetla za upravljanje prometom i označavanje mjesta radova i zapreka na cesti.', '(3) Svjetlo upotrjebljeno kao svjetlosni znak za upravljanje prometom može biti neprekidno ili trepćuće (prekidano).', '(4) Prometna svjetla mogu se, kada je to opravdano, postaviti na kontrastnu ploču bijele boje s rubom crne boje.', 'Članak 44.', '(1) Veličina prometnih svjetala:', '– za svjetla G01, G02, G03, G07, G08, G10 i G12 promjer kruga svjetala može biti 200, 210 ili 300 mm', '– za svjetla G09 i G11 promjer kruga svjetla je 300 mm.', '(2) Veličina prometnih svjetala G01 –G03 iznosi 300 mm kad se uređaj za davanje svjetlosnih znakova postavlja na autocestama ili brzim cestama.', '(3) Veličina prometnih svjetala G01, G02, G03 i G12 mora biti 300 mm ukoliko se postavljaju iznad prometne trake.', 'Članak 45.', '(1) Prometna svjetla za upravljanje prometom na raskrižjima postavljaju se s desne strane kolnika, moraju biti postavljena tako da je najniži donji rub svjetlosnog znaka na visini od 2,2 do 3,5 m iznad površine kolnika.', '(2) Iznimno od stavka 1. ovog članka, prometna svjetla mogu se postaviti na manjoj visini i s manjim promjerom svjetala.', '(3) Ako se prometna svjetla postavljaju iznad kolnika, donji rub prometnog svjetla ne smije biti na visini manjoj od 4,5 m ni na višoj od 5,5 m iznad kolnika.', '(4) Na prilazima raskrižju izvan naseljenog mjesta, na kojem su postavljena prometna svjetla za upravljanje prometom, moraju se postaviti prometni znakovi koji označavaju »nailazak na prometna svjetla« (A14 ili A14-1).', 'Članak 46.', '(1) Uz prometna svjetla može se postaviti uređaj za odbrojavanje preostalog vremena trajanja zelenog i crvenog svjetla. Odbrojavanje se obavlja u sekundama.', '(2) Za vrijeme trajanja zelenog svjetla brojevi na uređaju za odbrojavanje preostalog vremena su zelene boje, a za trajanja crvenog svjetla brojevi su crvene boje.', '1. Prometna svjetla za upravljanje prometom', 'Članak 47.', '(1) Prometna svjetla mogu se upotrebljavati za upravljanje prometom na više prometnih traka istodobno ili za svaku prometnu traku posebno.', '(2) Ako se uređajem iz stavka 1. ovog članka upravlja prometom posebno za svaku prometnu traku, prometna svjetla postavljena su iznad prometnih traka na koje se odnose.', '(3) Kada se prometna svjetla upotrebljavaju za upravljanje prometom na više prometnih traka i smjerova kretanja u različitim fazama, prometna svjetla se postavljaju s desne strane kolnika te za lijeve skretače s lijeve strane kolnika.', '(4) Na cestama s više od jedne prometne trake za svaki smjer kretanja nije potrebno postaviti prometna svjetla ukoliko svi smjerovi idu u istoj fazi.', '(5) Na crvenim svjetlosnim poljima prometnih svjetala strelica smjera je crna, a na zelenim svjetlosnim poljima strelice se uvijek prikazuju kao zelene svjetlosne strelice na crnoj podlozi.', '(6) Svjetlosni znakovi koji se daju prometnim svjetlima imaju sljedeće značenje:', '1) crveno svjetlo označava zabranjen prolazak vozila (G01-1)', '2) crveno i žuto svjetlo svjetleći istodobno označavaju skori prestanak zabrane prolaza i najavljuju pojavu zelenog svjetla, ali ne mijenjaju zabranu prolaska koja je dana crvenim svjetlom (G01-2)', '3) zeleno svjetlo označava slobodan prolaz vozila te mora biti upaljeno kao samostalno svjetlo (G01-3)', '4) žuto svjetlo upaljeno samostalno, poslije zelenog, a prije crvenog, znači da vozilo ne smije prijeći crtu zaustavljanja niti smije uči u raskrižje, ako se u trenutku kada se žuto svjetlo pojavi, nalazi na takvoj udaljenosti od prometnog svjetla da se može na siguran način zaustaviti (G01-4)', '5) žuto trepćuće svjetlo obavezuje sve sudionike u prometu da se kreću uz povećani oprez (G02)', '6) dopunska svjetleća strelica, a ovisno o stvarnoj situaciji na raskrižju, prikazuje mogućnost prolaza vozila u smjeru označenom zelenom svjetlećom strelicom za vrijeme dok je upaljeno crveno svjetlo (G03). Po potrebi, umjesto strelice može se koristiti simbol ili natpis vozila javnog gradskog prijevoza ili interventnih vozila', '7) oblici strelica prikazani su u tablici 8. pod kolonom 3 »Prikaz izgleda i boja pojedinačnih svjetala« (G01-5, G01-6 i G01-7)', '8) prekrižene crte crvene boje označavaju zabranu kretanja vozila uzduž prometne trake iznad koje se znak nalazi (G04)', '9) zelena strelica vrhom okrenutim nadolje označava slobodan prolazak vozila uzduž prometne trake iznad koje se nalazi (G05)', '10) žuta strelica vrhom okrenutim prema desnoj ili lijevoj strani označava skretanje vozila s prometne trake iznad koje se nalazi (G06)', '(7) Oznaka, boja, oblik i svrha označavanja, dopuštene varijante, dodatni zahtjevi i uvjeti za prometna svjetla za upravljanje prometom prikazani su u tablici 8.']",,
